### ISSUE TITLE
NIO mishandles EPOLLHUP

### ISSUE THREAD

**Issue by Lukasa** [apple/swift-nio#277]
## The Problem

Right now, NIO on Linux does not trigger any event on `EPOLLHUP`. This is because NIO never registers itself for EPOLLHUP, so it doesn't particularly expect to see it. That is, unfortunately, not how epoll works. From [the man page](https://linux.die.net/man/2/epoll_ctl):

> **EPOLLHUP**
> Hang up happened on the associated file descriptor. `epoll_wait`(2) will always wait for this event; it is not necessary to set it in events.

Put another way, `EPOLLHUP` is *unmaskable*: we cannot prevent `epoll_wait` from returning it to us.

Most of the time for regular TCP sockets this does not matter, as those sockets only ever provide us with `EPOLLHUP` if the socket is forcibly entirely shut down (that is, TCP RST). We mostly see TCP FIN, which triggers `EPOLLRDHUP` instead, and would only get TCP RST if we were writing data (and so would expect to see the error pretty early).

However, for UNIX sockets it is much easier to get into a "completely shut down" state without requiring us to shut our end of the connection down. In such a state, `epoll_wait` will return `EPOLLHUP`, which NIO will ignore. NIO will then immediately go back to `epoll_wait`, which immediately returns, putting us into a hot loop. Amusingly, this is a hot loop on `epoll`, so any other I/O events *will* be dispatched, and the loop will in general continue to serve other work: it'll just spend a bunch of time mismanaging FDs.

In most cases this is a transient state, as once a channel registers for readable or writable we'll register for `EPOLLRDHUP`, which will immediately be returned in addition to `EPOLLHUP` (for UNIX and TCP, the states where you get `EPOLLRDHUP` are a strict superset of the states where you get `EPOLLHUP`). However, if for any reason a channel does not register for readable or writable (or attempt to write) for a very long time, this busy loop can last indefinitely.

## Solutions

The status quo is clearly unacceptable. Here are a pair of options.

1. Treat a selectable that gets `EPOLLHUP` as being marked "readable", let it read EOF.

    This idea is conceptually the simplest. However, it breaks an invariant we'd been trying to enforce, which is that we don't want the user to get `channelInactive` and `channelRead` without an associated call to `read`. Of course, this was already not true, because calling `write` could cause this behaviour. So this might work well as a pragmatic solution.

2. Quietly unregister a selectable that gets `EPOLLHUP` from epoll, consider it always readable/writable.

    This idea allows us to delay the discovery of HUP as long as possible. Essentially, when we see EPOLLHUP we'll fire a variant of `deregister` that marks the selectable as being shut down for the selector. When the selectable next fires `reregister`, we'll catch it and immediately invoke the proper event, or wait until `waitForEvent` is called and quietly synthesise the appropriate event.

    This screws with control flow in a big way: the selector implementation gets a lot nastier and needs to manage a lot more state directly, at least in principle. However, it leads to the cleanest implementation in user code: users can continue to expect that reads and EOFs do not magically appear in their channels.

Any preferences?

**Comment by normanmaurer** [comment]
1) Sounds ok to me

**Comment by weissi** [comment]
just to add a bit of info: On a UDS without waiting for either read or write, we get this:

    [pid  8372] epoll_wait(8, [{EPOLLHUP, {u32=42, u64=42}}], 64, -1) = 1

over local TCP, I can't get it to throw EPOLLHUP (probably no `RST` packets). Over actual TCP/IP from another machine I always get

    [pid  8602] epoll_wait(11, [{EPOLLERR|EPOLLHUP, {u32=42, u64=42}}], 64, -1) = 1

which we always handled just fine (because of the `EPOLLERR`). The corresponding `tcpdump` looks like this

```
$ sudo tcpdump -i enp12s0 '' 'port 8888'
tcpdump: verbose output suppressed, use -v or -vv for full protocol decode
listening on enp12s0, link-type EN10MB (Ethernet), capture size 262144 bytes
13:33:29.004918 IP the_client.59796 > the_server.8888: Flags [S], seq 3876478010, win 65535, options [mss 1460,nop,wscale 5,nop,nop,TS val 504718047 ecr 0,sackOK,eol], length 0
13:33:29.004992 IP the_server.8888 > the_client.59796: Flags [S.], seq 202829076, ack 3876478011, win 28960, options [mss 1460,sackOK,TS val 197754992 ecr 504718047,nop,wscale 7], length 0
13:33:29.005210 IP the_client.59796 > the_server.8888: Flags [.], ack 1, win 4117, options [nop,nop,TS val 504718047 ecr 197754992], length 0
13:33:29.005276 IP the_client.59796 > the_server.8888: Flags [P.], seq 1:1025, ack 1, win 4117, options [nop,nop,TS val 504718047 ecr 197754992], length 1024
13:33:29.005298 IP the_server.8888 > the_client.59796: Flags [.], ack 1025, win 243, options [nop,nop,TS val 197754992 ecr 504718047], length 0
13:33:29.005325 IP the_client.59796 > the_server.8888: Flags [.], seq 1025:2473, ack 1, win 4117, options [nop,nop,TS val 504718047 ecr 197754992], length 1448
13:33:29.005340 IP the_server.8888 > the_client.59796: Flags [.], ack 2473, win 265, options [nop,nop,TS val 197754992 ecr 504718047], length 0
13:33:29.011759 IP the_server.8888 > the_client.59796: Flags [P.], seq 1:48, ack 234753, win 189, options [nop,nop,TS val 197754994 ecr 504718051], length 47
13:33:29.012101 IP the_client.59796 > the_server.8888: Flags [.], seq 234753:236201, ack 48, win 4116, options [nop,nop,TS val 504718053 ecr 197754994], length 1448
13:33:29.012123 IP the_client.59796 > the_server.8888: Flags [.], seq 236201:237649, ack 48, win 4116, options [nop,nop,TS val 504718053 ecr 197754994], length 1448
13:33:29.012130 IP the_client.59796 > the_server.8888: Flags [.], seq 237649:239097, ack 48, win 4116, options [nop,nop,TS val 504718053 ecr 197754994], length 1448
13:33:29.012137 IP the_client.59796 > the_server.8888: Flags [.], seq 239097:240545, ack 48, win 4116, options [nop,nop,TS val 504718053 ecr 197754994], length 1448
13:33:29.012144 IP the_client.59796 > the_server.8888: Flags [.], seq 240545:241993, ack 48, win 4116, options [nop,nop,TS val 504718053 ecr 197754994], length 1448
13:33:29.012168 IP the_client.59796 > the_server.8888: Flags [.], seq 241993:243441, ack 48, win 4116, options [nop,nop,TS val 504718053 ecr 197754994], length 1448
13:33:29.012179 IP the_client.59796 > the_server.8888: Flags [.], seq 243441:244889, ack 48, win 4116, options [nop,nop,TS val 504718053 ecr 197754994], length 1448
13:33:29.049664 IP the_server.8888 > the_client.59796: Flags [.], ack 257921, win 8, options [nop,nop,TS val 197755004 ecr 504718053], length 0
13:33:29.112234 IP the_server.8888 > the_client.59796: Flags [P.], seq 48:66, ack 257921, win 8, options [nop,nop,TS val 197755019 ecr 504718053], length 18
13:33:29.112532 IP the_client.59796 > the_server.8888: Flags [.], seq 257921:258945, ack 66, win 4115, options [nop,nop,TS val 504718152 ecr 197755019], length 1024
13:33:29.112613 IP the_server.8888 > the_client.59796: Flags [P.], seq 66:118, ack 258945, win 0, options [nop,nop,TS val 197755019 ecr 504718152], length 52
13:33:29.112802 IP the_client.59796 > the_server.8888: Flags [.], ack 118, win 4114, options [nop,nop,TS val 504718152 ecr 197755019], length 0
13:33:29.213073 IP the_server.8888 > the_client.59796: Flags [P.], seq 118:136, ack 258945, win 0, options [nop,nop,TS val 197755044 ecr 504718152], length 18
13:33:29.213356 IP the_client.59796 > the_server.8888: Flags [.], ack 136, win 4113, options [nop,nop,TS val 504718252 ecr 197755044], length 0
13:33:29.213511 IP the_server.8888 > the_client.59796: Flags [P.], seq 136:188, ack 258945, win 0, options [nop,nop,TS val 197755044 ecr 504718252], length 52
13:33:29.213818 IP the_client.59796 > the_server.8888: Flags [.], ack 188, win 4111, options [nop,nop,TS val 504718252 ecr 197755044], length 0
13:33:29.314068 IP the_server.8888 > the_client.59796: Flags [P.], seq 188:206, ack 258945, win 0, options [nop,nop,TS val 197755070 ecr 504718252], length 18
13:33:29.314338 IP the_client.59796 > the_server.8888: Flags [.], ack 206, win 4111, options [nop,nop,TS val 504718352 ecr 197755070], length 0
13:33:29.314478 IP the_server.8888 > the_client.59796: Flags [P.], seq 206:258, ack 258945, win 0, options [nop,nop,TS val 197755070 ecr 504718352], length 52
13:33:29.314699 IP the_client.59796 > the_server.8888: Flags [.], ack 258, win 4109, options [nop,nop,TS val 504718352 ecr 197755070], length 0
13:33:29.414960 IP the_server.8888 > the_client.59796: Flags [P.], seq 258:276, ack 258945, win 0, options [nop,nop,TS val 197755095 ecr 504718352], length 18
13:33:29.415360 IP the_client.59796 > the_server.8888: Flags [.], ack 276, win 4109, options [nop,nop,TS val 504718452 ecr 197755095], length 0
13:33:29.415402 IP the_server.8888 > the_client.59796: Flags [P.], seq 276:328, ack 258945, win 0, options [nop,nop,TS val 197755095 ecr 504718452], length 52
13:33:29.415611 IP the_client.59796 > the_server.8888: Flags [.], ack 328, win 4107, options [nop,nop,TS val 504718452 ecr 197755095], length 0
13:33:29.510116 IP the_client.59796 > the_server.8888: Flags [R.], seq 258945, ack 328, win 4107, length 0
```

and for the record, the command to trigger the TCP RST:

    yes "$( echo -e 'GET /dynamic/write-delay HTTP/1.1\r\n\r\n')" | nc the_server 8888 > /dev/null & sleep 0.5; kill -9 $!

which works fine to trigger a TCP RST on Linux over actual TCP/IP and on Darwin even on `lo0`.

**Comment by Lukasa** [comment]
Yeah, `EPOLLERR|EPOLLHUP` feels plausible for "proper" TCP: they want to tell you about "connection reset by peer". Frankly Linux's UDS behaviour here seems broken, but it's also our primary platform, so...I guess we're stuck with it.

**Comment by weissi** [comment]
#286 should fix this
