### ISSUE TITLE
Could not connect to local server from iOS simulator

### ISSUE THREAD

**Issue by hieunc278** [apple/swift-nio#1626]
### Expected behavior
app run on iOS simulator could connect local server on host successful

### Actual behavior
app run on iOS simulator could not connect local server on host. but localhost server is connected by cURL properly

### Steps to reproduce

1. Run server on host ( use Netty )
2. Run iOS App on simulator.
3. Connect to local server from simulator.

### If possible, minimal yet complete reproducer code (or URL to code)
import Foundation
import NIO

enum TCPClientError: Error {
    case invalidHost
    case invalidPort
}

class TCPClient {
    private let group = MultiThreadedEventLoopGroup(numberOfThreads: 1)
    private var host: String?
    private var port: Int?
    
    init(host: String, port: Int) {
        self.host = host
        self.port = port
    }
    
    func start() throws {
        guard let host = host else {
            throw TCPClientError.invalidHost
        }
        guard let port = port else {
            throw TCPClientError.invalidPort
        }
        do {
            let channel = try bootstrap.connect(host: host, port: port).wait()
            try channel.closeFuture.wait()
        } catch let error {
            throw error
        }
    }
    
    func stop() {
        do {
            try group.syncShutdownGracefully()
        } catch let error {
            print("Error shutting down \(error.localizedDescription)")
            exit(0)
        }
        print("Client connection closed")
    }
    
    private var bootstrap: ClientBootstrap {
        return ClientBootstrap(group: group)
            .channelOption(ChannelOptions.socket(SocketOptionLevel(SOL_SOCKET), SO_REUSEADDR), value: 1)
            .channelInitializer { channel in
                channel.pipeline.addHandler(TCPClientHandler())
        }
        
    }
}

_[anything to help us reproducing the issue]_
Console output log : 

2020-09-01 05:05:31.562214+0700 iDine[15933:709466] [ServicesDaemonManager] interruptionHandler is called. -[FontServicesDaemonManager connection]_block_invoke
Error: The operation couldn’t be completed. (NIO.ChannelError error 0.)
Client connection closed

### SwiftNIO version/commit hash

SwiftNIO 2.20.2

### Swift & OS version (output of `swift --version && uname -a`)

Apple Swift version 5.1 (swiftlang-1100.0.270.13 clang-1100.0.33.7)
Target: x86_64-apple-darwin19.3.0
Darwin Macs-MacBook-Air.local 19.3.0 Darwin Kernel Version 19.3.0: Thu Jan  9 20:58:23 PST 2020; root:xnu-6153.81.5~1/RELEASE_X86_64 x86_64

**Comment by glbrntt** [comment]
I'm not able to reproduce this using netcat to listen for connections. `NIO.ChannelError error 0.` seems to be a connect timeout; are you sure your host/port are correct?

**Comment by hieunc278** [comment]
Dear @glbrntt ,

Thanks for your feedback.

I think host/port information is correct, because I used cURL to make the connection and found that i could connect to server successfully.

And when I ran debug with SwiftNIO, I saw that dns was resolved successful, but it could not connect anyway.

I'm a little confuse as you think, because this is normal case. Do you have any idea about enable more logs to check this issue ? Or even remote to my environment also .

Best regards,
Hieu Nguyen

**Comment by Lukasa** [comment]
You cannot have run cURL from inside the simulator, so the network topology doesn't match. Can you please try using Safari **from within the simulator** to confirm whether you can reach the Netty service?

Can you also please say what the host and port you're using are?

**Comment by Davidde94** [comment]
To clarify, if you attempt to connect to `localhost` from within the simulator, you will connect to the simulator, not macOS. This is likely why it isn't working. Cory's suggestion above will help show this, as entering `localhost` in safari will also try to connect to the simulator.

Think of the simulator as any other VM/container. If you open up a docker container and run `curl localhost`, you'll connect to the container, not the underlying OS.

**Comment by PeterAdams-A** [comment]
I've failed to reproduce your problem too.

I ran NIOEchoServer on the Mac host (bound to 0.0.0.0:9999)
I ran an application with your above code in the iOS simulator (iPhone 11 Pro).  For IP I used IP address associated with the Mac hosts ethernet adapter.

I did change the `try channel.closeFuture.wait()` to `try channel.close().wait()` to close from the client side.

I also added a `writeAndFlush()` to send some data and that arrived in the echo server successfully too.

**Comment by hieunc278** [comment]
Dear @Lukasa , @Davidde94 , @PeterAdams-A ,

Thank you all for your feedbacks. 

Based on your comments, I have checked again would like have some feedbacks also : 

1. At server side, I bind localhost/9090 as hort/port information.
2. When I tried access localhost:9090 with Safari in simulator, it displayed "Safari could not open the page because the server stopped responding", because I saw exception occur at channelRead at server side. However, Safari could open as I think.

I used localhost/9090 with my client, but it still could not connect. And channelRead at server side was not occurred.

Here is my interface of my desktop environment, could you please review and give my any suggest about which host information I could use to make connection between iOS simulator to host app.

lo0: flags=8049<UP,LOOPBACK,RUNNING,MULTICAST> mtu 16384
	options=1203<RXCSUM,TXCSUM,TXSTATUS,SW_TIMESTAMP>
	inet 127.0.0.1 netmask 0xff000000 
	inet6 ::1 prefixlen 128 
	inet6 fe80::1%lo0 prefixlen 64 scopeid 0x1 
	nd6 options=201<PERFORMNUD,DAD>
gif0: flags=8010<POINTOPOINT,MULTICAST> mtu 1280
stf0: flags=0<> mtu 1280
XHC20: flags=0<> mtu 0
en0: flags=8863<UP,BROADCAST,SMART,RUNNING,SIMPLEX,MULTICAST> mtu 1500
	options=400<CHANNEL_IO>
	ether 2c:f0:ee:33:0a:74 
	inet6 fe80::1019:5729:a800:3d46%en0 prefixlen 64 secured scopeid 0x5 
	inet 192.168.0.101 netmask 0xffffff00 broadcast 192.168.0.255
	nd6 options=201<PERFORMNUD,DAD>
	media: autoselect
	status: active
en1: flags=8963<UP,BROADCAST,SMART,RUNNING,PROMISC,SIMPLEX,MULTICAST> mtu 1500
	options=460<TSO4,TSO6,CHANNEL_IO>
	ether 82:0d:7e:e1:00:00 
	media: autoselect <full-duplex>
	status: inactive
bridge0: flags=8863<UP,BROADCAST,SMART,RUNNING,SIMPLEX,MULTICAST> mtu 1500
	options=63<RXCSUM,TXCSUM,TSO4,TSO6>
	ether 82:0d:7e:e1:00:00 
	Configuration:
		id 0:0:0:0:0:0 priority 0 hellotime 0 fwddelay 0
		maxage 0 holdcnt 0 proto stp maxaddr 100 timeout 1200
		root id 0:0:0:0:0:0 priority 0 ifcost 0 port 0
		ipfilter disabled flags 0x2
	member: en1 flags=3<LEARNING,DISCOVER>
	        ifmaxaddr 0 port 6 priority 0 path cost 0
	nd6 options=201<PERFORMNUD,DAD>
	media: <unknown type>
	status: inactive
p2p0: flags=8843<UP,BROADCAST,RUNNING,SIMPLEX,MULTICAST> mtu 2304
	options=400<CHANNEL_IO>
	ether 0e:f0:ee:33:0a:74 
	media: autoselect
	status: inactive
awdl0: flags=8943<UP,BROADCAST,RUNNING,PROMISC,SIMPLEX,MULTICAST> mtu 1484
	options=400<CHANNEL_IO>
	ether 32:c8:a7:86:bc:70 
	inet6 fe80::30c8:a7ff:fe86:bc70%awdl0 prefixlen 64 scopeid 0x9 
	nd6 options=201<PERFORMNUD,DAD>
	media: autoselect
	status: active
llw0: flags=8863<UP,BROADCAST,SMART,RUNNING,SIMPLEX,MULTICAST> mtu 1500
	options=400<CHANNEL_IO>
	ether 32:c8:a7:86:bc:70 
	inet6 fe80::30c8:a7ff:fe86:bc70%llw0 prefixlen 64 scopeid 0xa 
	nd6 options=201<PERFORMNUD,DAD>
	media: autoselect
	status: active
utun0: flags=8051<UP,POINTOPOINT,RUNNING,MULTICAST> mtu 1380
	inet6 fe80::e082:946:4e62:e71a%utun0 prefixlen 64 scopeid 0xb 
	nd6 options=201<PERFORMNUD,DAD>
utun1: flags=8051<UP,POINTOPOINT,RUNNING,MULTICAST> mtu 2000
	inet6 fe80::9e45:d8:27e7:a4c6%utun1 prefixlen 64 scopeid 0xc 
	nd6 options=201<PERFORMNUD,DAD>

**Comment by Lukasa** [comment]
In your `catch let error` block, can you please print the error? That is, do `print("\(error)")`? That will give us a better idea of what the error is. Please do _not_ use `localizedDescription`.

**Comment by hieunc278** [comment]
Dear Mr. @Lukasa,

Thanks for your feedback.

This is error message when I changed as your suggestion.

"2020-09-10 06:01:59.522621+0700 iDine[25475:1153690] XPC connection interrupted
Error: connectTimeout(NIO.TimeAmount(nanoseconds: 10000000000))
Client connection closed"

**Comment by Lukasa** [comment]
Ok so this is a connect timeout. That implies that the port is firewalled off, or that nothing is listening there. Can you please print the string values of `host` and `port` as well?

**Comment by hieunc278** [comment]
Dear @Lukasa 

Thank you so much for your supports

Yes, server side listen at port 9090 with host is : localhost. This is code at server side : 


            ServerBootstrap b = new ServerBootstrap();
            b.localAddress("localhost", 9090);
            b.group(bossGroup, workerGroup)
                    .channel(NioServerSocketChannel.class)
                    .childHandler(new ChannelInitializer<SocketChannel>() {
                        @Override
                        public void initChannel(SocketChannel ch)
                                throws Exception {
                            ch.pipeline().addLast(
                                    new ProcessingHandler());
                        }
                    }).option(ChannelOption.SO_BACKLOG, 128)
                    .childOption(ChannelOption.SO_KEEPALIVE, true);

            ChannelFuture f = b.bind().sync();
            f.channel().closeFuture().sync();

**Comment by Lukasa** [comment]
Can you show me what's in `TCPClientHandler`, please?

**Comment by hieunc278** [comment]
Dear @Lukasa ,

Thanks for your supports.

I would like to share TCPClientHandler as below. Could you please review it ?

//
//  TCPClientHandler.swift
//  iDine
//
//  Created by Mac on 8/9/20.
//  Copyright © 2020 dth. All rights reserved.
//

import Foundation
import NIO

class TCPClientHandler: ChannelInboundHandler {
    typealias InboundIn = ByteBuffer
    typealias OutboundOut = ByteBuffer
    private var numBytes = 0
    
    // channel is connected, send a message
    func channelActive(ctx: ChannelHandlerContext) {
        let message = "SwiftNIO rocks!"
        var buffer = ctx.channel.allocator.buffer(capacity: message.utf8.count)
        buffer.writeString(message)
        ctx.writeAndFlush(wrapOutboundOut(buffer), promise: nil)
    }
    
    func channelRead(ctx: ChannelHandlerContext, data: NIOAny) {
        var buffer = unwrapInboundIn(data)
        let readableBytes = buffer.readableBytes
        if let received = buffer.readString(length: readableBytes) {
            print(received)
        }
        if numBytes == 0 {
            print("nothing left to read, close the channel")
            ctx.close(promise: nil)
        }
    }
    
    func errorCaught(ctx: ChannelHandlerContext, error: Error) {
        print("error: \(error.localizedDescription)")
        ctx.close(promise: nil)
    }
}

And here is file TCPClient.

//
//  TCPClient.swift
//  iDine
//
//  Created by Mac on 8/9/20.
//  Copyright © 2020 dth. All rights reserved.
//

import Foundation
import NIO

enum TCPClientError: Error {
    case invalidHost
    case invalidPort
}

class TCPClient {
    private let group = MultiThreadedEventLoopGroup(numberOfThreads: 1)
    private var host: String?
    private var port: Int?
    
    init(host: String, port: Int) {
        self.host = host
        self.port = port
    }
    
    func start() throws {
        guard let host = host else {
            throw TCPClientError.invalidHost
        }
        guard let port = port else {
            throw TCPClientError.invalidPort
        }
        do {
            let channel = try bootstrap.connect(host: host, port: port).wait()
            try channel.closeFuture.wait()
        } catch let error {
            throw error
        }
    }
    
    func stop() {
        do {
            try group.syncShutdownGracefully()
        } catch let error {
            print("Error shutting down \(error.localizedDescription)")
            exit(0)
        }
        print("Client connection closed")
    }
    
    private var bootstrap: ClientBootstrap {
        return ClientBootstrap(group: group)
            .channelOption(ChannelOptions.socket(SocketOptionLevel(SOL_SOCKET), SO_REUSEADDR), value: 1)
            .channelInitializer { channel in
                channel.pipeline.addHandler(TCPClientHandler())
        }
        
    }
}

**Comment by Lukasa** [comment]
Can you also show me your setup code where you call `TCPClient.init()` and `TCPClient.start`?

**Comment by hieunc278** [comment]
Dear @Lukasa ,

Yes, here it is :

                        let client = TCPClient(host: "localhost", port: 9090)
                        do {
                            try client.start()
                        } catch let error {
                            print("Error: \(error)")
                            client.stop()
                        }

**Comment by Lukasa** [comment]
Instead of using a Netty server, can you use `netcat`? Try starting a netcat server with `nc -l 127.0.0.1 9090` and then making the connection from the simulator.

**Comment by hieunc278** [comment]
Dear @Lukasa ,

Thanks for your supports.

I tested with nectar as you suggest and I'm afraid of the result is the same. 

I think this issue is not come from swift-nio library, I have actually not found the root cause.

**Comment by PeterAdams-A** [comment]
Maybe try rerunning using your non-local IP address (ie  192.168.0.101 in your listing above) everywhere instead of localhost/127.0.0.1 and see if that makes any difference.

**Comment by hieunc278** [comment]
Dear @PeterAdams-A,

Thanks for your feedback. I actually tried with your suggestion before and the result is the same. So I little confuse with this test flow as well

**Comment by hieunc278** [comment]
Dear @Lukasa , @PeterAdams-A ,

As I ran example that shipped together with SwiftSocket ( https://github.com/swiftsocket/SwiftSocket ), I saw that it could connect and send data normal, so I think it has not any issues at backend or network interface. And the issue is cause from SwiftNIO actually

**Comment by Lukasa** [comment]
Hmm, there are many differences between us and SwiftSocket, including that we support IPv6 and SwiftSocket doesn't, as well as the fact that we resolve DNS with `getaddrinfo` instead of with `gethostbyname`. Any of these could be relevant effects.

**Comment by hieunc278** [comment]
Dear @Lukasa ,

Thanks for your feedback.

Yes, I tested with SwiftSocket to make sure that endpoint is running properly only, and I know lots of different between that two library as well. 

Anyway, it's hard to believe that it has the basic case at my environment like that.

**Comment by hieunc278** [comment]
Dear @Lukasa ,

As I debug, I saw that it ran to beginConnecting method, so I think host was resolved properly. It seems that its issue while connecting to target and I saw "ioOnClosedChannel" message while connecting to target.

Do you have any idea about enable full log from swift nio to determine exact reason ?

**Comment by Lukasa** [comment]
`ioOnClosedChannel` is a different message altogether. This implies that the remote peer is _closing_ the connection. Can you use something like `tcpdump` to look at the packets on the server side?

**Comment by Davidde94** [comment]
@hieunc278 are you still struggling with this?

**Comment by weissi** [comment]
FWIW, this `tcpdump` command should help:

    sudo tcpdump -X -i lo0 '' 'port 9090'

@hieunc278 run that on your Mac, then start the server and run the client in the Simulator. After that you can paste the output into this.

**Comment by hieunc278** [comment]
@Davidde94, @weissi :

Thanks for your feedbacks.

Let me check again then let you know the result

**Comment by hieunc278** [comment]
Dear All,

I just don't know why but now I could connect to local server from iOS Simulator, so I would like to close this

**Comment by hieunc278** [comment]
Currently, when I connect to local server from Simulator, at server side, channelActive is fired, but not fired at client side

Mr. @weissi 

Here is tcp dump content, could you please review it then let me know if it has any issues ?

06:45:04.670909 IP 192.168.0.102.60973 > 192.168.0.102.9093: Flags [F.], seq 1, ack 1, win 6379, options [nop,nop,TS val 546759263 ecr 546679203], length 0
	0x0000:  4500 0034 0000 4000 4006 0000 c0a8 0066  E..4..@.@......f
	0x0010:  c0a8 0066 ee2d 2385 1570 90d6 c8e7 7193  ...f.-#..p....q.
	0x0020:  8011 18eb 8243 0000 0101 080a 2096 e25f  .....C........._
	0x0030:  2095 a9a3                                ....
06:45:04.670946 IP 192.168.0.102.9093 > 192.168.0.102.60973: Flags [.], ack 2, win 6379, options [nop,nop,TS val 546759263 ecr 546759263], length 0
	0x0000:  4500 0034 0000 4000 4006 0000 c0a8 0066  E..4..@.@......f
	0x0010:  c0a8 0066 2385 ee2d c8e7 7193 1570 90d7  ...f#..-..q..p..
	0x0020:  8010 18eb 8243 0000 0101 080a 2096 e25f  .....C........._
	0x0030:  2096 e25f                                ..._
06:45:04.672741 IP 192.168.0.102.9093 > 192.168.0.102.60973: Flags [F.], seq 1, ack 2, win 6379, options [nop,nop,TS val 546759264 ecr 546759263], length 0
	0x0000:  4500 0034 0000 4000 4006 0000 c0a8 0066  E..4..@.@......f
	0x0010:  c0a8 0066 2385 ee2d c8e7 7193 1570 90d7  ...f#..-..q..p..
	0x0020:  8011 18eb 8243 0000 0101 080a 2096 e260  .....C.........`
	0x0030:  2096 e25f                                ..._
06:45:04.672815 IP 192.168.0.102.60973 > 192.168.0.102.9093: Flags [.], ack 2, win 6379, options [nop,nop,TS val 546759264 ecr 546759264], length 0
	0x0000:  4500 0034 0000 4000 4006 0000 c0a8 0066  E..4..@.@......f
	0x0010:  c0a8 0066 ee2d 2385 1570 90d7 c8e7 7194  ...f.-#..p....q.
	0x0020:  8010 18eb 8243 0000 0101 080a 2096 e260  .....C.........`
	0x0030:  2096 e260                                ...`

**Comment by weissi** [comment]
@hieunc278 are you sure you got the pcap with `sudo tcpdump -X -i lo0 '' 'port 9090'` ? Because I see ports 9093 an 60973 and IP addresses 192.168.0.102 only. Also there is no connection establishment in there.

What we should see is traffic from and to 127.0.0.1 (localhost, both the Mac and the Simulator) and for each item, one of the ports should be `9090`. Also we should see a `S` flag (which stands for `SYN`) which is what TCP sends to open a fresh connection.

So the workflow would be:

1. Run `sudo tcpdump -X -i lo0 '' 'port 9090'`
2. Start your server
3. Start the app in the simulator
4. Reproduce the problem
5. wait a few seconds
6. Press Ctrl+C in the `tcpdump` window

then post the output. If it's too much, you can also write it to a file with `tcpdump -i lo0 -w /tmp/repro.pcap '' 'port 9090'` (but you'll need to repro everything again).

**Comment by hieunc278** [comment]
Dear @weissi,

Thank you for your very details information with your patient.

Actually I have just checked again, and found that it did not any issues with the connection between client( inside iOS Simulator ) and server ( host machine ), and the issue related to Protobuf decoder and encoder.

Now I could receive message normally.
